{
  "schema_version": 1,
  "trace_id": "trace-001",
  "status": "ok",
  "intent": {
    "schema_version": 1,
    "intent_id": "intent-001",
    "kind": "command",
    "action": "fs.create_folder",
    "confidence": 0.9,
    "entities": {},
    "risk": {
      "level": "medium",
      "reasons": []
    },
    "source": "rules"
  },
  "steps": [],
  "message": "Plan generated successfully"
}